{
  "$schema": "https://json-schema.org/draft/2020-12/schema",
  "$id": "https://github.com/AllanYiin/Documa/schema/documa.schema.json",
  "$comment": "Generated from src/documa/core/ir.py by scripts/generate_schema.py - do not edit by hand. Compatibility contract: ir_version follows semver; minor bumps are strictly additive (consumers must ignore unknown fields); removing or retyping fields requires a major bump.",
  "title": "DocumaDocumentIR",
  "ir_version": "0.2",
  "type": "object",
  "properties": {
    "id": {
      "type": "string"
    },
    "source_name": {
      "type": "string"
    },
    "ir_version": {
      "type": "string"
    },
    "parser": {
      "anyOf": [
        {
          "type": "string"
        },
        {
          "type": "null"
        }
      ]
    },
    "producer_version": {
      "anyOf": [
        {
          "type": "string"
        },
        {
          "type": "null"
        }
      ]
    },
    "adapter_version": {
      "anyOf": [
        {
          "type": "string"
        },
        {
          "type": "null"
        }
      ]
    },
    "pipeline_profile": {
      "anyOf": [
        {
          "type": "string"
        },
        {
          "type": "null"
        }
      ]
    },
    "pages": {
      "type": "array",
      "items": {
        "$ref": "#/$defs/PageIR"
      }
    },
    "tables": {
      "type": "array",
      "items": {
        "$ref": "#/$defs/TableIR"
      }
    },
    "relations": {
      "type": "array",
      "items": {
        "$ref": "#/$defs/RelationIR"
      }
    },
    "document_blocks": {
      "type": "array",
      "items": {
        "$ref": "#/$defs/DocumentBlockIR"
      }
    },
    "chunks": {
      "type": "array",
      "items": {
        "$ref": "#/$defs/ChunkIR"
      }
    },
    "metadata": {
      "type": "object"
    }
  },
  "required": [
    "id",
    "source_name"
  ],
  "$defs": {
    "PageIR": {
      "type": "object",
      "properties": {
        "id": {
          "type": "string"
        },
        "page_number": {
          "type": "integer"
        },
        "width": {
          "type": "number"
        },
        "height": {
          "type": "number"
        },
        "rotation": {
          "type": "integer"
        },
        "blocks": {
          "type": "array",
          "items": {
            "$ref": "#/$defs/BlockIR"
          }
        },
        "images": {
          "type": "array",
          "items": {
            "$ref": "#/$defs/ImageIR"
          }
        },
        "metadata": {
          "type": "object"
        }
      },
      "required": [
        "id",
        "page_number",
        "width",
        "height"
      ]
    },
    "BlockIR": {
      "type": "object",
      "properties": {
        "id": {
          "type": "string"
        },
        "type": {
          "type": "string",
          "enum": [
            "text",
            "paragraph",
            "heading",
            "table",
            "image",
            "chart",
            "footnote",
            "table_of_content",
            "page_header",
            "page_footer",
            "unknown"
          ]
        },
        "page_number": {
          "type": "integer"
        },
        "text": {
          "anyOf": [
            {
              "$ref": "#/$defs/TextContent"
            },
            {
              "type": "null"
            }
          ]
        },
        "bbox": {
          "anyOf": [
            {
              "type": "array",
              "prefixItems": [
                {
                  "type": "number"
                },
                {
                  "type": "number"
                },
                {
                  "type": "number"
                },
                {
                  "type": "number"
                }
              ],
              "minItems": 4,
              "maxItems": 4
            },
            {
              "type": "null"
            }
          ]
        },
        "spans": {
          "type": "array",
          "items": {
            "$ref": "#/$defs/SpanIR"
          }
        },
        "confidence": {
          "type": "string",
          "enum": [
            "high",
            "medium",
            "low",
            "unknown"
          ]
        },
        "order_index": {
          "anyOf": [
            {
              "type": "integer"
            },
            {
              "type": "null"
            }
          ]
        },
        "source_refs": {
          "type": "array",
          "items": {
            "type": "string"
          }
        },
        "metadata": {
          "type": "object"
        }
      },
      "required": [
        "id",
        "type",
        "page_number"
      ]
    },
    "TextContent": {
      "type": "object",
      "properties": {
        "raw_text": {
          "type": "string"
        },
        "normalized_text": {
          "anyOf": [
            {
              "type": "string"
            },
            {
              "type": "null"
            }
          ]
        },
        "unicode_form": {
          "type": "string"
        },
        "width_normalized": {
          "type": "boolean"
        },
        "simplified_traditional_converted": {
          "type": "boolean"
        }
      },
      "required": [
        "raw_text"
      ]
    },
    "SpanIR": {
      "type": "object",
      "properties": {
        "id": {
          "type": "string"
        },
        "text": {
          "$ref": "#/$defs/TextContent"
        },
        "bbox": {
          "anyOf": [
            {
              "type": "array",
              "prefixItems": [
                {
                  "type": "number"
                },
                {
                  "type": "number"
                },
                {
                  "type": "number"
                },
                {
                  "type": "number"
                }
              ],
              "minItems": 4,
              "maxItems": 4
            },
            {
              "type": "null"
            }
          ]
        },
        "font_size": {
          "anyOf": [
            {
              "type": "number"
            },
            {
              "type": "null"
            }
          ]
        },
        "font_name": {
          "anyOf": [
            {
              "type": "string"
            },
            {
              "type": "null"
            }
          ]
        },
        "style": {
          "type": "array",
          "items": {
            "type": "string",
            "enum": [
              "bold",
              "italic",
              "underline",
              "superscript",
              "subscript",
              "emphasis"
            ]
          }
        },
        "language": {
          "$ref": "#/$defs/LanguageHint"
        },
        "metadata": {
          "type": "object"
        }
      },
      "required": [
        "id",
        "text"
      ]
    },
    "LanguageHint": {
      "type": "object",
      "properties": {
        "language": {
          "type": "string"
        },
        "script": {
          "anyOf": [
            {
              "type": "string"
            },
            {
              "type": "null"
            }
          ]
        },
        "text_direction": {
          "type": "string"
        }
      }
    },
    "ImageIR": {
      "type": "object",
      "properties": {
        "id": {
          "type": "string"
        },
        "page_number": {
          "type": "integer"
        },
        "bbox": {
          "anyOf": [
            {
              "type": "array",
              "prefixItems": [
                {
                  "type": "number"
                },
                {
                  "type": "number"
                },
                {
                  "type": "number"
                },
                {
                  "type": "number"
                }
              ],
              "minItems": 4,
              "maxItems": 4
            },
            {
              "type": "null"
            }
          ]
        },
        "asset_ref": {
          "type": "string"
        },
        "image_type": {
          "type": "string"
        },
        "caption": {
          "anyOf": [
            {
              "type": "string"
            },
            {
              "type": "null"
            }
          ]
        },
        "confidence": {
          "type": "string",
          "enum": [
            "high",
            "medium",
            "low",
            "unknown"
          ]
        },
        "metadata": {
          "type": "object"
        }
      },
      "required": [
        "id",
        "page_number",
        "bbox",
        "asset_ref"
      ]
    },
    "TableIR": {
      "type": "object",
      "properties": {
        "id": {
          "type": "string"
        },
        "block_id": {
          "type": "string"
        },
        "rows": {
          "type": "array",
          "items": {
            "type": "array",
            "items": {
              "anyOf": [
                {
                  "type": "string"
                },
                {
                  "type": "null"
                }
              ]
            }
          }
        },
        "html": {
          "anyOf": [
            {
              "type": "string"
            },
            {
              "type": "null"
            }
          ]
        },
        "markdown": {
          "anyOf": [
            {
              "type": "string"
            },
            {
              "type": "null"
            }
          ]
        },
        "confidence": {
          "type": "string",
          "enum": [
            "high",
            "medium",
            "low",
            "unknown"
          ]
        },
        "metadata": {
          "type": "object"
        }
      },
      "required": [
        "id",
        "block_id"
      ]
    },
    "RelationIR": {
      "type": "object",
      "properties": {
        "id": {
          "type": "string"
        },
        "type": {
          "type": "string",
          "enum": [
            "footnote_marker_to_body",
            "toc_item_to_heading",
            "caption_to_image",
            "caption_to_table",
            "chunk_to_source",
            "block_parent_child",
            "block_to_source",
            "next_in_reading_order",
            "unresolved"
          ]
        },
        "from_id": {
          "type": "string"
        },
        "to_id": {
          "anyOf": [
            {
              "type": "string"
            },
            {
              "type": "null"
            }
          ]
        },
        "confidence": {
          "type": "string",
          "enum": [
            "high",
            "medium",
            "low",
            "unknown"
          ]
        },
        "state": {
          "type": "string",
          "enum": [
            "inferred",
            "confirmed",
            "rejected",
            "unresolved"
          ]
        },
        "evidence": {
          "type": "array",
          "items": {
            "type": "string"
          }
        },
        "metadata": {
          "type": "object"
        }
      },
      "required": [
        "id",
        "type",
        "from_id"
      ]
    },
    "DocumentBlockIR": {
      "type": "object",
      "properties": {
        "id": {
          "type": "string"
        },
        "type": {
          "type": "string",
          "enum": [
            "document",
            "section",
            "page",
            "paragraph",
            "table",
            "image",
            "footnote",
            "table_of_content",
            "metadata",
            "unknown"
          ]
        },
        "title": {
          "anyOf": [
            {
              "type": "string"
            },
            {
              "type": "null"
            }
          ]
        },
        "parent_id": {
          "anyOf": [
            {
              "type": "string"
            },
            {
              "type": "null"
            }
          ]
        },
        "child_ids": {
          "type": "array",
          "items": {
            "type": "string"
          }
        },
        "source_block_ids": {
          "type": "array",
          "items": {
            "type": "string"
          }
        },
        "source_chunk_ids": {
          "type": "array",
          "items": {
            "type": "string"
          }
        },
        "page_refs": {
          "type": "array",
          "items": {
            "type": "integer"
          }
        },
        "bbox_refs": {
          "type": "array",
          "items": {
            "type": "array",
            "prefixItems": [
              {
                "type": "number"
              },
              {
                "type": "number"
              },
              {
                "type": "number"
              },
              {
                "type": "number"
              }
            ],
            "minItems": 4,
            "maxItems": 4
          }
        },
        "text_preview": {
          "anyOf": [
            {
              "type": "string"
            },
            {
              "type": "null"
            }
          ]
        },
        "content_hash": {
          "anyOf": [
            {
              "type": "string"
            },
            {
              "type": "null"
            }
          ]
        },
        "depth": {
          "type": "integer"
        },
        "order_index": {
          "anyOf": [
            {
              "type": "integer"
            },
            {
              "type": "null"
            }
          ]
        },
        "confidence": {
          "type": "string",
          "enum": [
            "high",
            "medium",
            "low",
            "unknown"
          ]
        },
        "metadata": {
          "type": "object"
        }
      },
      "required": [
        "id",
        "type"
      ]
    },
    "ChunkIR": {
      "type": "object",
      "properties": {
        "id": {
          "type": "string"
        },
        "text": {
          "$ref": "#/$defs/TextContent"
        },
        "source_block_ids": {
          "type": "array",
          "items": {
            "type": "string"
          }
        },
        "parent_block_id": {
          "anyOf": [
            {
              "type": "string"
            },
            {
              "type": "null"
            }
          ]
        },
        "heading_path": {
          "type": "array",
          "items": {
            "type": "string"
          }
        },
        "page_refs": {
          "type": "array",
          "items": {
            "type": "integer"
          }
        },
        "bbox_refs": {
          "type": "array",
          "items": {
            "type": "array",
            "prefixItems": [
              {
                "type": "number"
              },
              {
                "type": "number"
              },
              {
                "type": "number"
              },
              {
                "type": "number"
              }
            ],
            "minItems": 4,
            "maxItems": 4
          }
        },
        "asset_refs": {
          "type": "array",
          "items": {
            "type": "string"
          }
        },
        "relation_ids": {
          "type": "array",
          "items": {
            "type": "string"
          }
        },
        "metadata": {
          "type": "object"
        }
      },
      "required": [
        "id",
        "text",
        "source_block_ids"
      ]
    }
  }
}
