{
  "id": "doc_v01_compat_fixture",
  "source_name": "fixtures\\pdf\\real\\annual-report.pdf",
  "ir_version": "0.1",
  "parser": "pymupdf",
  "pages": [
    {
      "id": "page_1",
      "page_number": 1,
      "width": 595.0,
      "height": 842.0,
      "rotation": 0,
      "blocks": [
        {
          "id": "p1_b1",
          "type": "heading",
          "page_number": 1,
          "text": {
            "raw_text": "Aurora Materials Annual Report",
            "normalized_text": "Aurora Materials Annual Report",
            "unicode_form": "NFC",
            "width_normalized": false,
            "simplified_traditional_converted": false
          },
          "bbox": [
            56.0,
            96.45999908447266,
            387.2759094238281,
            126.75399780273438
          ],
          "spans": [
            {
              "id": "p1_s1_0",
              "text": {
                "raw_text": "Aurora Materials Annual Report",
                "normalized_text": "Aurora Materials Annual Report",
                "unicode_form": "NFC",
                "width_normalized": false,
                "simplified_traditional_converted": false
              },
              "bbox": [
                56.0,
                96.45999908447266,
                387.2759094238281,
                126.75399780273438
              ],
              "font_size": 22.0,
              "font_name": "Helvetica-Bold",
              "style": [
                "bold"
              ],
              "language": {
                "language": "en",
                "script": "Latin",
                "text_direction": "ltr"
              },
              "metadata": {
                "origin": [
                  56.0,
                  120.0
                ]
              }
            }
          ],
          "confidence": "high",
          "order_index": 1,
          "source_refs": [
            "pymupdf:block:1:1"
          ],
          "metadata": {
            "source_type": "pymupdf_text_block",
            "original_order_index": 1,
            "reading_order": {
              "column_index": 0,
              "strategy": "simple_column_gap"
            },
            "layout_classification": {
              "previous_type": "text",
              "strategy": "font_size_and_page_position",
              "median_font_size": 10.0,
              "block_font_size": 22.0
            }
          }
        },
        {
          "id": "p1_b2",
          "type": "heading",
          "page_number": 1,
          "text": {
            "raw_text": "Fiscal Year Summary",
            "normalized_text": "Fiscal Year Summary",
            "unicode_form": "NFC",
            "width_normalized": false,
            "simplified_traditional_converted": false
          },
          "bbox": [
            56.0,
            136.08999633789062,
            180.24098205566406,
            153.69200134277344
          ],
          "spans": [
            {
              "id": "p1_s1_1",
              "text": {
                "raw_text": "Fiscal Year Summary",
                "normalized_text": "Fiscal Year Summary",
                "unicode_form": "NFC",
                "width_normalized": false,
                "simplified_traditional_converted": false
              },
              "bbox": [
                56.0,
                136.08999633789062,
                180.24098205566406,
                153.69200134277344
              ],
              "font_size": 13.0,
              "font_name": "Helvetica-Oblique",
              "style": [
                "italic",
                "italic"
              ],
              "language": {
                "language": "en",
                "script": "Latin",
                "text_direction": "ltr"
              },
              "metadata": {
                "origin": [
                  56.0,
                  150.0
                ]
              }
            }
          ],
          "confidence": "high",
          "order_index": 2,
          "source_refs": [
            "pymupdf:block:1:2"
          ],
          "metadata": {
            "source_type": "pymupdf_text_block",
            "original_order_index": 2,
            "reading_order": {
              "column_index": 0,
              "strategy": "simple_column_gap"
            },
            "layout_classification": {
              "previous_type": "text",
              "strategy": "font_size_and_page_position",
              "median_font_size": 10.0,
              "block_font_size": 13.0
            }
          }
        },
        {
          "id": "p1_b3",
          "type": "heading",
          "page_number": 1,
          "text": {
            "raw_text": "Contents",
            "normalized_text": "Contents",
            "unicode_form": "NFC",
            "width_normalized": false,
            "simplified_traditional_converted": false
          },
          "bbox": [
            56.0,
            205.02000427246094,
            116.66201782226562,
            224.29800415039062
          ],
          "spans": [
            {
              "id": "p1_s1_2",
              "text": {
                "raw_text": "Contents",
                "normalized_text": "Contents",
                "unicode_form": "NFC",
                "width_normalized": false,
                "simplified_traditional_converted": false
              },
              "bbox": [
                56.0,
                205.02000427246094,
                116.66201782226562,
                224.29800415039062
              ],
              "font_size": 14.0,
              "font_name": "Helvetica-Bold",
              "style": [
                "bold"
              ],
              "language": {
                "language": "en",
                "script": "Latin",
                "text_direction": "ltr"
              },
              "metadata": {
                "origin": [
                  56.0,
                  220.0
                ]
              }
            }
          ],
          "confidence": "high",
          "order_index": 3,
          "source_refs": [
            "pymupdf:block:1:3"
          ],
          "metadata": {
            "source_type": "pymupdf_text_block",
            "original_order_index": 3,
            "reading_order": {
              "column_index": 0,
              "strategy": "simple_column_gap"
            },
            "layout_classification": {
              "previous_type": "text",
              "strategy": "font_size_and_page_position",
              "median_font_size": 10.0,
              "block_font_size": 14.0
            }
          }
        },
        {
          "id": "p1_b4",
          "type": "table_of_content",
          "page_number": 1,
          "text": {
            "raw_text": "1. Overview ................................................ 2",
            "normalized_text": "1. Overview ................................................ 2",
            "unicode_form": "NFC",
            "width_normalized": false,
            "simplified_traditional_converted": false
          },
          "bbox": [
            56.0,
            239.25,
            253.34994506835938,
            252.99000549316406
          ],
          "spans": [
            {
              "id": "p1_s1_3",
              "text": {
                "raw_text": "1. Overview ................................................ 2",
                "normalized_text": "1. Overview ................................................ 2",
                "unicode_form": "NFC",
                "width_normalized": false,
                "simplified_traditional_converted": false
              },
              "bbox": [
                56.0,
                239.25,
                253.34994506835938,
                252.99000549316406
              ],
              "font_size": 10.0,
              "font_name": "Helvetica",
              "style": [],
              "language": {
                "language": "en",
                "script": "Latin",
                "text_direction": "ltr"
              },
              "metadata": {
                "origin": [
                  56.0,
                  250.0
                ]
              }
            }
          ],
          "confidence": "high",
          "order_index": 4,
          "source_refs": [
            "pymupdf:block:1:4"
          ],
          "metadata": {
            "source_type": "pymupdf_text_block",
            "original_order_index": 4,
            "reading_order": {
              "column_index": 0,
              "strategy": "simple_column_gap"
            },
            "toc_title": "1. Overview",
            "toc_items": [
              {
                "title": "1. Overview",
                "page_number": 2,
                "page_label": "2"
              }
            ],
            "layout_classification": {
              "previous_type": "text",
              "strategy": "toc_leader_dots",
              "median_font_size": 10.0,
              "block_font_size": 10.0
            }
          }
        },
        {
          "id": "p1_b5",
          "type": "table_of_content",
          "page_number": 1,
          "text": {
            "raw_text": "2. Financial Results ................................................ 2",
            "normalized_text": "2. Financial Results ................................................ 2",
            "unicode_form": "NFC",
            "width_normalized": false,
            "simplified_traditional_converted": false
          },
          "bbox": [
            56.0,
            259.25,
            287.8099365234375,
            272.989990234375
          ],
          "spans": [
            {
              "id": "p1_s1_4",
              "text": {
                "raw_text": "2. Financial Results ................................................ 2",
                "normalized_text": "2. Financial Results ................................................ 2",